{
	"Name": "BasketFruit",
	"Stage": 3,
	"Tier": 3,
	"Abilities": [
		{
			"Name": "Recover 4% MaxHealth per second.",
			"ActivationTrigger": {
				"TriggerType": "EveryXTime",
				"ActivateEveryTimeMs": 1000
			},
			"TotalDurationMs": 0,
			"Skills": [
				{
					"Name": "Instant heal",
					"Deployment": {
						"Type": "Direct"
					},
					"Targeting": {
						"Type": "Self"
					},
					"EffectPackage": {
						"Effects": [
							{
								"Type": "InstantHeal",
								"HealType": "Normal",
								"Expression": {
									"Percentage": 5,
									"Stat": "MaxHealth",
									"StatSource": "Receiver"
								}
							}
						]
					}
				}
			]
		}
	]
}
