{
	"Name": "JellyFruit",
	"Stage": 0,
	"Tier": 0,
	"Abilities": [
		{
			"Name": "Consumable - Jelly Fruit",
			"ActivationTrigger": {
				"TriggerType": "OnBattleStart"
			},
			"TotalDurationMs": 0,
			"Skills": [
				{
					"Name": "OP and Energy Regen buff",
					"Deployment": {
						"Type": "Direct"
					},
					"Targeting": {
						"Type": "Self"
					},
					"EffectPackage": {
						"Effects": [
							{
								"Type": "Buff",
								"Stat": "OmegaPowerPercentage",
								"DurationMs": -1,
								"Expression": 15
							},
							{
								"Type": "Buff",
								"Stat": "EnergyRegeneration",
								"Expression": 150,
								"DurationMs": -1
							}
						]
					}
				}
			]
		}
	]
}
