{
	"Name": "SpikeJuice",
	"Stage": 3,
	"Tier": 3,
	"Abilities": [
		{
			"Name": "Gain Indomitable for 10 seconds.",
			"ActivationTrigger": {
				"TriggerType": "OnBattleStart"
			},
			"TotalDurationMs": 0,
			"Skills": [
				{
					"Name": "Indomitable",
					"Targeting": {
						"Type": "Self"
					},
					"Deployment": {
						"Type": "Direct"
					},
					"EffectPackage": {
						"Effects": [
							{
								"Type": "Buff",
								"Stat": "PhysicalVampPercentage",
								"DurationMs": -1,
								"Expression": 28
							},
							{
								"Type": "Buff",
								"Stat": "EnergyVampPercentage",
								"DurationMs": -1,
								"Expression": 28
							},
							{
								"Type": "Buff",
								"Stat": "PureVampPercentage",
								"DurationMs": -1,
								"Expression": 28
							}
						]
					}
				}
			]
		}
	]
}
