{
	"Name": "NaniticDiscord",
	"Stage": 3,
	"Tier": 3,
	"Abilities": [
		{
			"Name": "Debuff - Nanitic Discord",
			"ActivationTrigger": {
				"TriggerType": "OnBattleStart"
			},
			"TotalDurationMs": 0,
			"Skills": [
				{
					"Name": "Attack Speed debuff",
					"Deployment": {
						"Type": "Direct"
					},
					"Targeting": {
						"Type": "Self"
					},
					"EffectPackage": {
						"Effects": [
							{
								"Type": "Buff",
								"Stat": "AttackSpeed",
								"DurationMs": -1,
								"Expression": {
									"Percentage": -35,
									"Stat": "AttackSpeed",
									"StatSource": "Receiver",
									"StatEvaluationType": "Base"
								}
							}
						]
					}
				}
			]
		}
	]
}
